{
  "$schema": "http://json-schema.org/draft-07/schema#",
  "title": "referenceData v1.15",
  "description": "reference Data for GVMS v1.15",
  "type": "object",
  "properties": {
    "routes": {
      "description": "The routes covered by GVMS",
      "type": "array",
      "items": {
        "type": "object",
        "properties": {
          "routeId": {
            "description": "The route identifier",
            "type": "string"
          },
          "routeDirection": {
            "description": "The direction of the route",
            "type": "string",
            "enum": [
              "UK_INBOUND",
              "UK_OUTBOUND",
              "GB_TO_NI",
              "NI_TO_GB"
            ]
          },
          "routeEffectiveFrom": {
            "description": "Date the route came into effect",
            "type": "string",
            "format": "date"
          },
          "departurePortId": {
            "description": "The id of the departure port",
            "type": "integer"
          },
          "arrivalPortId": {
            "description": "The id of the arrival port",
            "type": "integer"
          },
          "carrierId": {
            "description": "the id of the carrier operating that route",
            "type": "integer"
          },
          "routeEffectiveTo": {
            "description": "The date the route stopped being used",
            "type": "string",
            "format": "date"
          }
        },
        "required": [
          "routeId",
          "routeDirection",
          "routeEffectiveFrom",
          "departurePortId",
          "arrivalPortId",
          "carrierId"
        ]
      }
    },
    "ports": {
      "type": "array",
      "items": {
        "type": "object",
        "properties": {
          "portId": {
            "description": "The id of the port",
            "type": "integer"
          },
          "portRegion": {
            "description": "The region the port is grouped into for CTC",
            "type": "string"
          },
          "portEffectiveFrom": {
            "description": "The date the port came into effect",
            "type": "string",
            "format": "date"
          },
          "portDescription": {
            "description": "Description of the port eg: the port's name",
            "type": "string",
            "minLength": 3,
            "maxLength": 255
          },
          "timezoneId": {
            "description": "The UTC Identifier",
            "type": "string",
            "maxLength": 50
          },
          "chiefPortCode": {
            "description": "The port code specific to CHIEF",
            "type": "string"
          },
          "cdsPortCode": {
            "description": "The port code specific to CDS",
            "type": "string"
          },
          "officeOfTransitCustomsOfficeCode": {
            "description": "Customs office code for CTC",
            "type": "string",
            "minLength": 8,
            "maxLength": 8
          },
          "portEffectiveTo": {
            "description": "The date the port stopped being used",
            "type": "string",
            "format": "date"
          },
          "portCountryCode": {
            "description": "The Country code of the associated Port",
            "type": "string",
            "pattern": "^[A-Z]{2}$"
          },
          "isOperatingArrivedExportsProcess": {
            "description": "If true, indicates that this port is operating the arrived exports process and as such requires all customs export declarations to be pre-arrived prior to check-in.  If omitted or false, indicates that this port is operating the standard exports process.",
            "type": "boolean"
          }
        },
        "required": [
          "portId",
          "portEffectiveFrom",
          "portDescription",
          "officeOfTransitCustomsOfficeCode",
          "portCountryCode"
        ]
      }
    },
    "carriers": {
      "type": "array",
      "items": {
        "type": "object",
        "properties": {
          "carrierId": {
            "description": "The id of the carrier",
            "type": "integer"
          },
          "carrierName": {
            "description": "The name of the carrier",
            "type": "string",
            "minLength": 1,
            "maxLength": 255
          },
          "countryCode": {
            "description": "The country code where the carrier is registered",
            "type": "string",
            "pattern": "^[A-Z]{2}$"
          }
        },
        "required": [
          "carrierId",
          "carrierName"
        ]
      }
    },
    "locations": {
      "type": "array",
      "items": {
        "type": "object",
        "properties": {
          "locationId": {
            "description": "The id of the inspection facility.",
            "type": "string"
          },
          "locationDescription": {
            "description": "The name of the inspection facility location.",
            "type": "string"
          },
          "address": {
            "description": "The address where the inspection facility is located.",
            "type": "object",
            "properties": {
              "lines": {
                "description": "The building name or number, and street name where the inspection facility is located.",
                "type": "array",
                "minItems": 1,
                "maxItems": 4,
                "items": {
                  "type": "string"
                }
              },
              "town": {
                "description": "The town where the inspection facility is located.",
                "type": "string"
              },
              "postcode": {
                "description": "The postcode where the inspection facility is located.",
                "type": "string"
              }
            },
            "required": [
              "lines",
              "postcode"
            ]
          },
          "locationType": {
            "description": "The type of inspection facility; either Inland Border Facility (IBF), Border Control Post (BCP) or a facility that carries out all inspection types (ALL).",
            "type": "string",
            "enum": [
              "IBF",
              "BCP",
              "ALL"
            ]
          },
          "supportedDirections": {
            "description": "The directions of travel supported by the location.",
            "type": "array",
            "minItems": 1,
            "maxItems": 4,
            "items": {
              "type": "string",
              "enum": [
                "UK_INBOUND",
                "UK_OUTBOUND",
                "GB_TO_NI",
                "NI_TO_GB"
              ]
            }
          },
          "locationEffectiveFrom": {
            "description": "The date the inspection facility location starts being used.",
            "type": "string",
            "format": "date"
          },
          "locationEffectiveTo": {
            "description": "The date the inspection facility location stops being used.",
            "type": "string",
            "format": "date"
          },
          "supportedInspectionTypeIds": {
            "description": "The list of inspectionTypeIds for the types of inspections carried out.",
            "type": "array",
            "minItems": 1,
            "items": {
              "type": "string"
            }
          },
          "requiredInspectionLocations": {
            "description": "The list of portIds that the inspection facility supports.",
            "type": "array",
            "minItems": 1,
            "items": {
              "type": "integer"
            }
          }
        },
        "required": [
          "locationId",
          "locationDescription",
          "address",
          "locationType",
          "locationEffectiveFrom",
          "supportedDirections",
          "supportedInspectionTypeIds",
          "requiredInspectionLocations"
        ]
      }
    },
    "inspectionTypes": {
      "type": "array",
      "items": {
        "type": "object",
        "properties": {
          "inspectionTypeId": {
            "description": "The id of the type of inspection that needs to be performed on the vehicle.",
            "type": "string"
          },
          "description": {
            "description": "The category of the type of inspection that needs to be performed on the vehicle e.g. CUSTOMS, DEFRA or TRANSIT.",
            "type": "string"
          }
        },
        "required": [
          "inspectionTypeId",
          "description"
        ]
      }
    },
    "ruleFailures": {
      "description": "The list of business and other possible rule failures within a GMR",
      "type": "array",
      "items": {
        "type": "object",
        "properties": {
          "ruleId": {
            "type": "string"
          },
          "ruleDescription": {
            "type": "string"
          }
        },
        "required": [
          "ruleId",
          "ruleDescription"
        ]
      }
    }
  }
}